{
  "schema_version": "1.0",
  "lesson_id": "LSN-AGENTMGR-005",
  "title": "来源项目专有的存档迁移脚本顺序约束",
  "content_class": "SOURCE_SPECIFIC_EXPERIENCE",
  "status": "VERIFIED",
  "evidence_level": "E2_REPRODUCED",
  "source": {
    "source_id": "agentmgr",
    "evidence_kind": "pull_request",
    "evidence_urls": ["https://github.com/ctrlshiftaltdel/AgentMgr/pull/777"],
    "observed_at": "2026-09-30T00:00:00Z",
    "captured_at": "2026-10-25T00:00:00Z",
    "source_commit": "0123456789abcdef0123456789abcdef01234567"
  },
  "observation": {
    "observed_fact": "来源项目要求先迁移存档再重建索引，顺序颠倒会得到不一致的索引。",
    "repro_conditions": "在来源项目隔离环境中按相反顺序执行两条脚本即可复现。",
    "root_cause": "来源项目的存档格式与索引重建强耦合。",
    "impact": "迁移后索引与存档不一致，需要重跑迁移。",
    "why_missed": "来源项目的迁移测试只覆盖正确顺序。"
  },
  "fingerprint": {
    "algorithm": "sha256-normalized-v1",
    "value": "4444444444444444444444444444444444444444444444444444444444444444",
    "normalized_fields": ["root_cause", "impact", "suggested_action_target"]
  },
  "duplicate_of": null,
  "conflicts_with": [],
  "applicability": {
    "scope": "source_only",
    "applies_to": ["存档迁移"],
    "excluded_contexts": ["AgentOrch 核心契约", "没有存档概念的项目"]
  },
  "suggested_action": {
    "target": "DOCUMENTATION",
    "summary": "仅保留为来源知识，不进入 AgentOrch 通用规则。",
    "cost": "LOW",
    "risk": "LOW",
    "validation_command": null
  },
  "created_at": "2026-10-25T00:00:00Z",
  "updated_at": "2026-10-25T00:00:00Z"
}
